{
  "schema": "ue.agent-skill.v1",
  "schemaVersion": 1,
  "id": "ue-blueprint-buildgraph",
  "version": "1.1.0",
  "title": "UE Blueprint BuildGraph",
  "description": "Validate and compile a declarative managed Blueprint Graph definition into an approved, recoverable Workflow v2 execution.",
  "domains": ["blueprint"],
  "risk": "mixed",
  "triggers": [
    "blueprint buildgraph",
    "declarative blueprint graph",
    "generate blueprint graph",
    "blueprint template",
    "蓝图模板",
    "reconcile blueprint nodes",
    "声明式蓝图",
    "批量构建蓝图图表"
  ],
  "entrypoint": "SKILL.md",
  "requirements": {
    "engine": { "min": "5.3" },
    "capabilities": [
      "blueprint.build.from_spec",
      "blueprint.graph.build.validate",
      "blueprint.graph.build.plan",
      "blueprint.graph.build.execute",
      "blueprint.graph.build.definition.get",
      "blueprint.graph.get",
      "blueprint.graph.snapshot",
      "blueprint.graph.diff",
      "blueprint.layout.validate",
      "blueprint.asset.validate"
    ],
    "optionalCapabilities": [
      "blueprint.template.list",
      "blueprint.template.apply",
      "blueprint.asset.runtime.verify",
      "blueprint.graph.describe",
      "blueprint.graph.capture",
      "blueprint.graph.visual.compare"
    ]
  },
  "recipes": [
    {
      "id": "plan-named-template",
      "title": "Discover and plan one named Blueprint behavior template",
      "description": "Read exact template parameters and limits, then produce a read-only managed Workflow plan for separately approved execution. Version 2 templates generate connected minimal health, timer and interaction behavior; actual instance behavior requires runtime verification.",
      "risk": "readOnly",
      "inputs": [
        { "name": "templateName", "type": "string", "required": true, "description": "Name from blueprint.template.list." },
        { "name": "blueprint", "type": "string", "required": true, "description": "Explicit existing Blueprint asset path." },
        { "name": "parameters", "type": "object", "required": false, "description": "Typed values allowed by the discovered template parameterSchema." }
      ],
      "steps": [
        {
          "id": "discover-template",
          "phase": "discover",
          "purpose": "Read template scope, exact parameter schema and lifecycle limits before selecting a behavior template.",
          "operations": ["blueprint.template.list"]
        },
        {
          "id": "plan-template",
          "phase": "execute",
          "purpose": "Produce a read-only spec-normalized Workflow and Editor-bound digest without applying or approving writes.",
          "operations": ["blueprint.template.apply"]
        },
        {
          "id": "verify-definition",
          "phase": "verify",
          "purpose": "Validate the returned normalizedDefinition; review the Workflow and approve its exact digest separately before executing through ue-workflow-cli.",
          "operations": ["blueprint.graph.build.validate"]
        }
      ],
      "result": {
        "summary": "A behavior-template application plan requiring separate Workflow approval, execution and runtime verification.",
        "evidence": ["template parameter schema and limitations", "resolved parameters and normalizedDefinition", "Workflow and Editor-bound planDigest", "applied=false and executionRequired=true"],
        "success": ["the template and typed parameters were discovered and validated", "the returned Workflow was planned against the current clean asset", "no asset write or runtime verification was inferred from planning"]
      }
    },
    {
      "id": "build-and-verify",
      "title": "Build and verify one managed Blueprint Graph",
      "description": "Compile a versioned BuildGraph definition to Workflow v2, execute the approved plan, and verify ownership, structure, layout, and recovery evidence.",
      "risk": "confirmWrite",
      "inputs": [
        { "name": "definition", "type": "object", "required": true, "description": "Complete ue.blueprint-buildgraph.v1 definition." }
      ],
      "steps": [
        {
          "id": "read-baseline",
          "phase": "discover",
          "purpose": "Read the current managed definition and structural Graph baseline.",
          "operations": ["blueprint.graph.build.definition.get", "blueprint.graph.get", "blueprint.graph.snapshot"]
        },
        {
          "id": "validate-and-plan",
          "phase": "execute",
          "purpose": "Validate ownership and compile the definition into a normalized Workflow v2 plan.",
          "operations": ["blueprint.graph.build.validate", "blueprint.graph.build.plan"]
        },
        {
          "id": "execute-approved-workflow",
          "phase": "execute",
          "purpose": "Execute the exact approved Workflow through the Editor-bound BuildGraph command with explicit approval, one transaction, compile/read-back, durable checkpoints, and existing rollback semantics.",
          "operations": ["blueprint.graph.build.execute"]
        },
        {
          "id": "verify",
          "phase": "verify",
          "purpose": "Verify managed refs, graph identity, structural diff, compile status, and layout diagnostics.",
          "operations": ["blueprint.graph.build.definition.get", "blueprint.graph.get", "blueprint.graph.diff", "blueprint.layout.validate", "blueprint.asset.validate"]
        },
        {
          "id": "verify-execution-subflow",
          "phase": "verify",
          "purpose": "Verify stable execution node, pin, and edge identities from a declared event or function entry when flow evidence is requested.",
          "operations": ["blueprint.graph.describe"],
          "optional": true
        }
      ],
      "result": {
        "summary": "Approved declarative Blueprint Graph reconciliation with managed ownership and Workflow recovery evidence.",
        "evidence": [
          "BuildGraph definition and build ID",
          "before and after graph hashes",
          "Workflow plan digest and run ID",
          "managed ref to NodeGuid mapping",
          "structural diff and compile diagnostics",
          "layout and optional capture evidence",
          "durable recovery and rollback state"
        ],
        "success": [
          "the definition passed bounded schema and ownership validation",
          "the exact planned Workflow digest was approved and executed",
          "all declared refs resolve to stable managed nodes",
          "unmanaged nodes remain untouched",
          "compile and structural verification pass",
          "idempotent replay produces no duplicate nodes or connections"
        ]
      }
    }
  ],
  "resources": [
    { "path": "references/buildgraph-recipe.md", "description": "Ownership, planning, Workflow recovery, and verification rules." }
  ]
}
